{
  "version": 2,
  "cell": "forecasting",
  "merge": {"strategy": "squash", "checks": ["cell-test", "cell-review"], "human_approvals": 0},
  "spending": "ask",
  "projects": [
    {"name": "airo", "repo": "elsehow/airo", "upstream": "forecastingresearch/airo", "vm": "airo-dev", "profile": "airo", "branch": "main", "test": "python -m pip install -e '.[test]' && python -m pytest -q"},
    {"name": "agent-box", "repo": "elsehow/agent-box", "upstream": "forecastingresearch/agent-box", "vm": "agent-box-dev", "profile": "-", "branch": "main", "test": "npm ci && python -m unittest discover -s tests -v"}
  ],
  "doors": {"upstream": "yours", "publish": "yours", "submission": "yours", "private_data": "yours"}
}
